{
  "$schema": "https://json-schema.org/draft/2020-12/schema",
  "$id": "https://github.com/nick-parcel/parcel-skills/schemas/plugin.schema.json",
  "title": "Claude Code plugin manifest (plugin.json)",
  "type": "object",
  "additionalProperties": false,
  "required": ["name"],
  "properties": {
    "name": { "type": "string", "pattern": "^[a-z][a-z0-9-]*$" },
    "displayName": { "type": "string" },
    "version": { "type": "string" },
    "description": { "type": "string" },
    "author": {
      "type": "object",
      "additionalProperties": false,
      "required": ["name"],
      "properties": {
        "name": { "type": "string" },
        "email": { "type": "string" },
        "url": { "type": "string" }
      }
    },
    "homepage": { "type": "string" },
    "repository": { "type": "string" },
    "license": { "type": "string" },
    "keywords": { "type": "array", "items": { "type": "string" } },
    "metadata": { "type": "object" },
    "defaultEnabled": { "type": "boolean" }
  }
}
