{
  "name": "builder",
  "version": "0.3.1",
  "description": "Parcel's builder plugin: connect an AI client to Parcel and use open Parcel skills.",
  "author": { "name": "Parcel" },
  "license": "Apache-2.0",
  "homepage": "https://github.com/nick-parcel/builder",
  "repository": "https://github.com/nick-parcel/builder",
  "keywords": ["parcel", "mcp", "skills", "builder"]
}
